{
  "schema_version": "assessment-package-v1",
  "package_contract": "midterm-package-v1",
  "package_id": "midterm-package-1", "package_version": 1, "kind": "midterm",
  "tenant_id": "tenant-a", "learner_id": "usr_learner_a", "programme_id": "programme-a", "course_id": "course-databases",
  "learning_path_id": "path-tenant-a-001", "learning_path_version": 2,
  "approved_plan_id": "plan-tenant-a-7", "approved_plan_version": 4,
  "blueprint": { "blueprint_id": "midterm-balanced", "blueprint_version": 2, "required_question_count": 2, "integration_minimum": 1, "max_week_concentration": 0.5 },
  "generator_prompt": { "prompt_id": "assessment.midterm.generate", "prompt_version": "2.1.0", "trace_id": "agent-trace-midterm-1" },
  "scope": { "week_numbers": [1, 2, 3, 4], "chapter_ids": ["foundations-ch1", "foundations-ch2", "databases-ch1", "databases-ch2"], "objective_ids": ["obj-1", "obj-2", "obj-3", "obj-4"], "semester_complete": false },
  "questions": [
    {
      "question_id": "midterm-q1", "question_hash": "fbd7f10fb78d2c00d279f4d9dae2be2af16167ff8813f9a4d54b6d8d2ad3adb6", "format": "mcq",
      "prompt": "Which durability property is required before a replicated acknowledgement?",
      "options": ["A persisted log entry", "A client-side cache", "A schema rename", "A read-only transaction"], "correct_option": "A", "answer_key": "A", "rubric": null,
      "difficulty": "medium", "integration": true, "objective_ids": ["obj-1", "obj-3"],
      "provenance": [{ "document_id": "book-foundations", "content_key": "sha256:aaaaaaaaaaaaaaaaaaaaaaaaaaaaaaaaaaaaaaaaaaaaaaaaaaaaaaaaaaaaaaaa.pipeline:bbbbbbbbbbbbbbbbbbbbbbbbbbbbbbbbbbbbbbbbbbbbbbbbbbbbbbbbbbbbbbbb", "week": 1, "chapter_id": "foundations-ch1", "page_start": 70, "page_end": 76, "section": "Persistence", "passage_ids": ["passage-foundations-70"] }]
    },
    {
      "question_id": "midterm-q2", "question_hash": "448cf58adef55e9f56273a2edf890b16f624cdafa1009b150b8ef4afd3608c93", "format": "mcq",
      "prompt": "Which record lets recovery repeat a committed operation?",
      "options": ["Write-ahead log", "UI cache", "DNS record", "Session cookie"], "correct_option": "A", "answer_key": "A", "rubric": null,
      "difficulty": "hard", "integration": false, "objective_ids": ["obj-4"],
      "provenance": [{ "document_id": "book-databases", "content_key": "sha256:1212121212121212121212121212121212121212121212121212121212121212.pipeline:bbbbbbbbbbbbbbbbbbbbbbbbbbbbbbbbbbbbbbbbbbbbbbbbbbbbbbbbbbbbbbbb", "week": 3, "chapter_id": "databases-ch1", "page_start": 130, "page_end": 139, "section": "Recovery logs", "passage_ids": ["passage-db-130"] }]
    }
  ],
  "created_at": "2026-09-23T12:00:00Z"
}
