{
  "schema_version": "assessment-package-v1",
  "package_contract": "final-package-v1",
  "package_id": "final-package-1", "package_version": 1, "kind": "final",
  "tenant_id": "tenant-a", "learner_id": "usr_learner_a", "programme_id": "programme-a", "course_id": "course-systems",
  "learning_path_id": "path-tenant-a-001", "learning_path_version": 2,
  "approved_plan_id": "plan-tenant-a-7", "approved_plan_version": 4,
  "blueprint": { "blueprint_id": "final-cumulative", "blueprint_version": 5, "required_question_count": 2, "integration_minimum": 1, "max_week_concentration": 0.5 },
  "generator_prompt": { "prompt_id": "assessment.final.generate", "prompt_version": "2.1.0", "trace_id": "agent-trace-final-1" },
  "scope": { "week_numbers": [1, 2, 3, 4, 5, 6, 7], "chapter_ids": ["foundations-ch1", "foundations-ch2", "databases-ch1", "databases-ch2", "databases-ch3", "distributed-ch1", "distributed-ch2"], "objective_ids": ["obj-1", "obj-2", "obj-3", "obj-4", "obj-5", "obj-6", "obj-7"], "semester_complete": true },
  "questions": [
    {
      "question_id": "final-q1", "question_hash": "832c630d6727c027ec09cb2d71754dd283dfa46237983595ebb45685916aff09", "format": "mcq",
      "prompt": "Which foundation is shared by durable local and replicated writes?",
      "options": ["Explicit persistence before acknowledgement", "A global filename", "A client clock", "A placeholder retry"], "correct_option": "A", "answer_key": "A", "rubric": null,
      "difficulty": "medium", "integration": true, "objective_ids": ["obj-1", "obj-7"],
      "provenance": [{ "document_id": "book-foundations", "content_key": "sha256:aaaaaaaaaaaaaaaaaaaaaaaaaaaaaaaaaaaaaaaaaaaaaaaaaaaaaaaaaaaaaaaa.pipeline:bbbbbbbbbbbbbbbbbbbbbbbbbbbbbbbbbbbbbbbbbbbbbbbbbbbbbbbbbbbbbbbb", "week": 1, "chapter_id": "foundations-ch1", "page_start": 70, "page_end": 76, "section": "Persistence", "passage_ids": ["passage-foundations-70"] }]
    },
    {
      "question_id": "final-q2", "question_hash": "4cffe941e1049b053823898e5cf5c4d14ab81ed80afc5fca587e66ea79c47ef0", "format": "essay",
      "prompt": "Compare failure recovery in a local log and a replicated state machine.",
      "options": [], "correct_option": null, "answer_key": "A complete answer contrasts replay scope and consensus ordering.", "rubric": "Award points for local replay, distributed ordering, and one evidence-backed tradeoff.",
      "difficulty": "hard", "integration": true, "objective_ids": ["obj-2", "obj-7"],
      "provenance": [{ "document_id": "book-distributed", "content_key": "sha256:3434343434343434343434343434343434343434343434343434343434343434.pipeline:bbbbbbbbbbbbbbbbbbbbbbbbbbbbbbbbbbbbbbbbbbbbbbbbbbbbbbbbbbbbbbbb", "week": 7, "chapter_id": "distributed-ch2", "page_start": 155, "page_end": 170, "section": "Replicated state machines", "passage_ids": ["passage-dist-155"] }]
    }
  ],
  "created_at": "2026-10-14T12:00:00Z"
}
